"Status","Start Time","Stop Time","Duration in ms","Parent Suite","Suite","Sub Suite","Test Class","Test Method","Name","Description"
"passed","Tue Jul 04 01:11:15 GMT 2023","Tue Jul 04 01:11:17 GMT 2023","1299","tests","test_main_page","TestMainPage","","","TC 13.01.50 - Check if block 1 'home-pants' in section 2 is clickablein the Promo Block on the main page","This test checks if block 1 'home-pants' in section 2 in Promo Block under header is clickable"
"passed","Tue Jul 04 01:11:33 GMT 2023","Tue Jul 04 01:11:36 GMT 2023","3620","tests","test_main_page","TestMainPage","","","TC 13.02.02 - Check the link in section 2 block 1 'home-pants' in the Promo Block leads to the correct page","Check that link in section 2 block 1 'home-pants' is correct"
"passed","Tue Jul 04 00:59:07 GMT 2023","Tue Jul 04 00:59:11 GMT 2023","4231","tests","test_create_an_account","TestCreateAnAccount","","","test 04.02.08 create an account with registered email"," Verify that customer can't Create An Account with registered email before "
"passed","Tue Jul 04 01:20:52 GMT 2023","Tue Jul 04 01:20:52 GMT 2023","521","tests","test_training","TestMainPage","","","TC 16.02.06 Check the cursor change to block training main ","This test check the cursor change when hovering over the block training main"
"passed","Tue Jul 04 00:58:42 GMT 2023","Tue Jul 04 00:58:42 GMT 2023","93","tests","test_create_an_account","TestCreateAnAccount","","","TC 04_01_10 Verify Sign in Information heading"," Verify that Sign in Information heading is present"
"passed","Tue Jul 04 01:02:35 GMT 2023","Tue Jul 04 01:02:37 GMT 2023","1158","tests","test_footer","TestFooter","","","TC 02.01.36 - Check display of Copyright text on each page specified in DATA_1","Checks if Copyright text is visible on each page in DATA_1"
"passed","Tue Jul 04 01:15:28 GMT 2023","Tue Jul 04 01:15:29 GMT 2023","1019","tests","test_sale","TestSalePage","","","TC 10.01.03, 10.01.05, 10.01.07, 10.01.09, 10.01.11, 10.01.13 - Verify 6 links in Women's Deals open the correct pages","Check that six links in Women's Deals section lead to the correct pages after click"
"passed","Tue Jul 04 01:08:22 GMT 2023","Tue Jul 04 01:08:23 GMT 2023","1354","tests","test_main_page","TestMainPage","","","test_verify_the_card_has_title","This test checks that the card has title"
"passed","Tue Jul 04 01:01:05 GMT 2023","Tue Jul 04 01:01:07 GMT 2023","1316","tests","test_footer","TestFooter","","","TC 02.01.13 - Check Advanced Search link is present in the DOM tree on each page specified in DATA_1","Checks if Advanced Search link is present in the DOM tree on each page specified in DATA_1"
"passed","Tue Jul 04 01:16:26 GMT 2023","Tue Jul 04 01:16:26 GMT 2023","272","tests","test_sale","TestSalePage","","","TC 10.04.02 - Verify the text in main block - Women's Deals","Check title-text and content-text in main block - Women's Deals"
"skipped","Tue Jul 04 01:09:23 GMT 2023","Tue Jul 04 01:09:23 GMT 2023","0","tests","test_main_page","TestMainPage","","","Check the transition to the page my wish after clicking on the button. User is authorized","
            This test will check that after clicking on the add to wishlist button,
            you are redirected to the My Wishlist page
            User is authorized
            "
"passed","Tue Jul 04 01:03:51 GMT 2023","Tue Jul 04 01:03:51 GMT 2023","67","tests","test_forgot_your_password","TestForgotYourPassword","","","TC 17.01.01 Verify Forgot Your Password Page h1 Header","Check Login Page Heading is present "
"passed","Tue Jul 04 01:02:20 GMT 2023","Tue Jul 04 01:02:21 GMT 2023","1139","tests","test_footer","TestFooter","","","TC 02.01.32 - Check text of Write for us link on each page specified in DATA_1","Checks if text of Write for us link is correct on each page in DATA_1"
"passed","Tue Jul 04 01:13:26 GMT 2023","Tue Jul 04 01:13:28 GMT 2023","1402","tests","test_men","TestMenPagePromoBlock","","","TC 14.06.33 Verify the visibility of 'Luma hoodies' promo block.","Verify that the block 'Luma hoodies' is displayed on the Men page"
"passed","Tue Jul 04 01:19:28 GMT 2023","Tue Jul 04 01:19:28 GMT 2023","258","tests","test_sign_in","TestRegisteredCustomers","","","TC 03.01.11 Verify Password field is appropriately labeled","Check if Password field is appropriately labeled "
"passed","Tue Jul 04 01:01:52 GMT 2023","Tue Jul 04 01:01:54 GMT 2023","1304","tests","test_footer","TestFooter","","","TC 02.01.24 - Check display of Contact Us link on each page specified in DATA_1","Checks if Contact Us link is visible on each page in DATA_1"
"passed","Tue Jul 04 01:13:21 GMT 2023","Tue Jul 04 01:13:22 GMT 2023","1407","tests","test_men","TestMenPagePromoBlock","","","TC 14.06.31 Verify that the 'Shop Tees' text is visible.","Verify that text-3 in 'Luma tees' block correctly displayed"
"passed","Tue Jul 04 01:12:12 GMT 2023","Tue Jul 04 01:12:14 GMT 2023","2499","tests","test_men","TestMenPage","","","TC 14.03.03 Verify the link 'Hoodies&Sweatshirts' redirects to a correct page.","Verify that the link 'Hoodies&Sweatshirts' correctly opens and redirects to a new webpage, the header         'Hoodies&Sweatshirt' is displayed"
"passed","Tue Jul 04 01:09:26 GMT 2023","Tue Jul 04 01:09:28 GMT 2023","1177","tests","test_main_page","TestMainPage","","","TC 13.01.01 - Check the display of the Promo Block under header on the main page","This test checks if Promo Block under header is displayed on the main page"
"passed","Tue Jul 04 01:12:58 GMT 2023","Tue Jul 04 01:12:59 GMT 2023","1331","tests","test_men","TestMenPagePromoBlock","","","TC 14.06.22 Verify the visibility of the image in the 'Luma shorts' promo block.","Verify that the image in the block 'Luma shorts' is displayed on the Men page"
"passed","Tue Jul 04 01:19:52 GMT 2023","Tue Jul 04 01:19:52 GMT 2023","53","tests","test_sign_in","TestNewCustomers","","","TC 03.01.20 Verify New Customers note","Check if Note is present under New Customers Heading"
"passed","Tue Jul 04 01:10:25 GMT 2023","Tue Jul 04 01:10:26 GMT 2023","1378","tests","test_main_page","TestMainPage","","","TC 13.01.29 - Check the display of the text in block 3 'home-erin' in the Promo Block","This test checks if the info block text in section 2 block 3 'home-erin' is correct
            in the Promo Block under header on the main page"
"passed","Tue Jul 04 00:58:30 GMT 2023","Tue Jul 04 00:58:31 GMT 2023","272","tests","test_create_an_account","TestCreateAnAccount","","","TC 04_01_06"," Verify presence of Last name label and the required asterisk "
"passed","Tue Jul 04 01:15:43 GMT 2023","Tue Jul 04 01:15:43 GMT 2023","58","tests","test_sale","TestSalePage","","","TC 10.02.02, 10.02.04, 10.02.06, 10.02.08, 10.02.10 - Verify 5 links in Men's Deals section are visible and clickable","Check that five elements in Men's Deals section are displayed and enabled"
"passed","Tue Jul 04 01:17:02 GMT 2023","Tue Jul 04 01:17:04 GMT 2023","2153","tests","test_shopping_cart","TestShoppingCart","","","tc 07.01.04 Verify that here link leads to the main page","Verify that the link ""here"" redirects to the main page."
"passed","Tue Jul 04 01:11:23 GMT 2023","Tue Jul 04 01:11:24 GMT 2023","1347","tests","test_main_page","TestMainPage","","","TC 13.01.53 - Check if block 4 'home-performance' in section 2 is clickablein the Promo Block on the main page","This test checks if block 4 'home-performance' in section 2 in Promo Block under header is clickable"
"passed","Tue Jul 04 01:08:03 GMT 2023","Tue Jul 04 01:08:05 GMT 2023","2198","tests","test_header","TestHeader","","","TC 01.03.11 display and interactivity of the ""Bottoms"" section of the ""Women"" section","Check the 'Bottoms' subsection in 'Women' section is displayed and the 'Pants' and 'Shorts'         subsections is displayed"
"passed","Tue Jul 04 01:02:13 GMT 2023","Tue Jul 04 01:02:15 GMT 2023","1089","tests","test_footer","TestFooter","","","TC 02.01.30 - Check if Write for us link is clickable on each page specified in DATA_1","This test checks if Write for us link is clickable on each page specified in DATA_1"
"passed","Tue Jul 04 01:09:31 GMT 2023","Tue Jul 04 01:09:33 GMT 2023","1362","tests","test_main_page","TestMainPage","","","TC 13.01.03 - Check the display of the image in section 1 'home-main' in the Promo Block page","This test checks if the image in section 1 'home-main' is correct
            in the Promo Block under header on the main page"
"passed","Tue Jul 04 01:13:48 GMT 2023","Tue Jul 04 01:13:48 GMT 2023","70","tests","test_orders_and_returns","TestOrdersAndReturnsPage","","","TC 05.01.03 - Verify that 'Order ID' input field is visible","This test checks Order ID input field is visible"
"passed","Tue Jul 04 01:13:00 GMT 2023","Tue Jul 04 01:13:02 GMT 2023","1350","tests","test_men","TestMenPagePromoBlock","","","TC 14.06.23 Verify that the 'Luma shorts' text is visible.","Verify that text-1 in 'Luma shorts' block correctly displayed"
"passed","Tue Jul 04 01:11:01 GMT 2023","Tue Jul 04 01:11:03 GMT 2023","1340","tests","test_main_page","TestMainPage","","","TC 13.01.44 - Check block 1 'home-pants' in section 2 of the Promo Block is present in the DOM tree","This test checks if block 1 'home-pants' in section 2 in the Promo Block is present
            in the DOM tree on the main page"
"skipped","Tue Jul 04 01:20:21 GMT 2023","Tue Jul 04 01:20:21 GMT 2023","0","tests","test_sign_in","TestFailedLogin","","","TC 03.02.01 to 03_02_10 Verify and Failed Login, no error validation","Check Success and Failed Login, no error validation"
"passed","Tue Jul 04 01:03:25 GMT 2023","Tue Jul 04 01:03:26 GMT 2023","1341","tests","test_footer","TestFooter","","","TC 02.01.47 - Check Email field in Subscribe section is present in the DOM tree on each page specified in DATA_1","Checks if Email field in Subscribe section is present in the DOM tree on each page specified in DATA_1"
"passed","Tue Jul 04 01:00:54 GMT 2023","Tue Jul 04 01:00:55 GMT 2023","1112","tests","test_footer","TestFooter","","","TC 02.01.09 - Check display of Privacy and Cookie Policy link on each page specified in DATA_1","Checks if Privacy and Cookie Policy link is visible on each page in DATA_1"
"passed","Tue Jul 04 00:58:39 GMT 2023","Tue Jul 04 00:58:39 GMT 2023","131","tests","test_create_an_account","TestCreateAnAccount","","","TC 04_01_09 Verify checkbox is present and unchecked"," Verify that checkbox is present and unchecked"
"passed","Tue Jul 04 00:59:52 GMT 2023","Tue Jul 04 01:00:03 GMT 2023","10902","tests","test_create_an_account","TestCreateAnAccount","","","TC 04_02_12 Verify presence of strong password strength hint"," Verify presence of Password Strength hint and warning color of weak password "
"skipped","Tue Jul 04 01:20:21 GMT 2023","Tue Jul 04 01:20:21 GMT 2023","0","tests","test_sign_in","TestFailedLogin","","","TC 03.02.01 to 03_02_10 Verify and Failed Login, no error validation","Check Success and Failed Login, no error validation"
"passed","Tue Jul 04 01:10:47 GMT 2023","Tue Jul 04 01:10:48 GMT 2023","1374","tests","test_main_page","TestMainPage","","","TC 13.01.38 - Check the display of the title in block 5 'home-eco' in the Promo Block","This test checks if the info block title in section 2 block 5 'home-eco' is correct
            in the Promo Block under header on the main page"
"passed","Tue Jul 04 01:07:08 GMT 2023","Tue Jul 04 01:07:12 GMT 2023","3777","tests","test_header","TestHeader","","","TC 01.03.22 correctness of the ""Tanks"" link of the ""Men"" section","Check 'Tanks' subsection link click in 'Men' section redirects to the Tanks-men page and         the 'Tanks' header is displayed"
"passed","Tue Jul 04 01:03:37 GMT 2023","Tue Jul 04 01:03:38 GMT 2023","1333","tests","test_footer","TestFooter","","","TC 02.01.49 - Check placeholder in Subscribe Email Field is present in the DOM tree on each page specified in DATA_1","Checks if placeholder in Email field is present in the DOM tree on each page specified in DATA_1"
"passed","Tue Jul 04 01:13:16 GMT 2023","Tue Jul 04 01:13:17 GMT 2023","1377","tests","test_men","TestMenPagePromoBlock","","","TC 14.06.29 Verify that the 'Luma tees' text is visible.","Verify that text-1 in 'Luma tees' block correctly displayed"
"passed","Tue Jul 04 01:20:24 GMT 2023","Tue Jul 04 01:20:24 GMT 2023","75","tests","test_training","TestMainPage","","","TC 16.01.01 Verify Sidebar panel title Shop By is visible and contains text 'Shop By'","Check Sidebar Shop By title has correct text and is visible"
"passed","Tue Jul 04 01:21:14 GMT 2023","Tue Jul 04 01:21:15 GMT 2023","1331","tests","test_women","TestWomenPage","","","TC 12.01.01 Check side panel title Shop By is visible","Check Shop By title is visible"
"passed","Tue Jul 04 01:21:05 GMT 2023","Tue Jul 04 01:21:06 GMT 2023","1022","tests","test_training_video_download","TestTrainingVideoDownload","","","TC 18.01.03 message ""You have no items to compare."" is displayed","Verify message 'You have no items to compare.' is visible"
"passed","Tue Jul 04 01:02:52 GMT 2023","Tue Jul 04 01:02:54 GMT 2023","1413","tests","test_footer","TestFooter","","","TC 02.01.39 - Check display of Subscribe section on each page specified in DATA_1","Checks if Subscribe section is visible on each page in DATA_1"
"passed","Tue Jul 04 01:01:45 GMT 2023","Tue Jul 04 01:01:46 GMT 2023","1338","tests","test_footer","TestFooter","","","TC 02.01.23 - Check Contact Us link is present in the DOM tree on each page specified in DATA_1","Checks if Contact Us link is present in the DOM tree on each page specified in DATA_1"
"passed","Tue Jul 04 01:02:31 GMT 2023","Tue Jul 04 01:02:32 GMT 2023","983","tests","test_footer","TestFooter","","","TC 02.01.35 - Check Copyright text is present in the DOM tree on each page specified in DATA_1","Checks if Copyright text is present in the DOM tree on each page specified in DATA_1"
"passed","Tue Jul 04 01:05:36 GMT 2023","Tue Jul 04 01:05:36 GMT 2023","387","tests","test_header","TestHeader","","","TC 01.03.03 display and interactivity of the ""Women"" section","Verify that the section Women in the header is visible and interactive"
"passed","Tue Jul 04 01:12:33 GMT 2023","Tue Jul 04 01:12:35 GMT 2023","2673","tests","test_men","TestMenPage","","","TC 14.03.09 Verify the link 'Tanks' redirects to a correct page.","Verify that the link 'Tanks' correctly opens and redirects to a new webpage,         the header 'Tanks' is displayed"
"passed","Tue Jul 04 01:13:29 GMT 2023","Tue Jul 04 01:13:30 GMT 2023","1192","tests","test_men","TestMenPagePromoBlock","","","TC 14.06.34 Verify the visibility of the image in the 'Luma hoodies' promo block.","Verify that the image in the block 'Luma hoodies' is displayed on the Men page"
"passed","Tue Jul 04 01:20:29 GMT 2023","Tue Jul 04 01:20:29 GMT 2023","90","tests","test_training","TestMainPage","","","TC 16.01.03 Verify Sidebar title Video Download is visible and contains text 'Video Download'","Check Sidebar Video Download title has correct text and is visible"
"passed","Tue Jul 04 01:12:00 GMT 2023","Tue Jul 04 01:12:01 GMT 2023","1362","tests","test_men","TestMenPage","","","TC 14.02.04 Verify the link 'Bottoms' is visible and clickable.",""
"passed","Tue Jul 04 01:03:27 GMT 2023","Tue Jul 04 01:03:29 GMT 2023","1429","tests","test_footer","TestFooter","","","TC 02.01.47 - Check Email field in Subscribe section is present in the DOM tree on each page specified in DATA_1","Checks if Email field in Subscribe section is present in the DOM tree on each page specified in DATA_1"
"passed","Tue Jul 04 01:20:31 GMT 2023","Tue Jul 04 01:20:31 GMT 2023","71","tests","test_training","TestMainPage","","","TC 16.01.04 Verify Sidebar panel title Video Download contains URL","Check Sidebar Video Download contains URL"
"passed","Tue Jul 04 01:20:49 GMT 2023","Tue Jul 04 01:20:50 GMT 2023","401","tests","test_training","TestMainPage","","","TC 16.02.05 Verify title Training is visible and contains text 'Top Videos'","Check Top Videos title has correct text and is visible"
"passed","Tue Jul 04 01:09:29 GMT 2023","Tue Jul 04 01:09:30 GMT 2023","1261","tests","test_main_page","TestMainPage","","","TC 13.01.02 - Check the display of section 1 in the Promo Block","This test checks if section 1 in Promo Block under header is displayed on the main page"
"passed","Tue Jul 04 01:09:41 GMT 2023","Tue Jul 04 01:09:43 GMT 2023","1401","tests","test_main_page","TestMainPage","","","TC 13.01.10 - Check display of block 1 'home-pants' in section 2 in the Promo Block","This test checks if block 1 'home-pants' is displayed in section 2
            of Promo Block under header on the main page"
"passed","Tue Jul 04 01:02:29 GMT 2023","Tue Jul 04 01:02:30 GMT 2023","992","tests","test_footer","TestFooter","","","TC 02.01.34 - Check display of Copyright section on each page specified in DATA_1","Checks if Copyright section is visible on each page in DATA_1"
"skipped","Tue Jul 04 01:20:21 GMT 2023","Tue Jul 04 01:20:21 GMT 2023","0","tests","test_sign_in","TestFailedLogin","","","TC 03.02.02 to 03_02_10 Verify Error on Failed Login with invalid credentials","Check error on Failed Login with invalid credentials, case-sensitive password and password with spaces"
"skipped","Tue Jul 04 01:08:58 GMT 2023","Tue Jul 04 01:09:10 GMT 2023","11984","tests","test_main_page","TestMainPage","","","Check the display of the add to wish and add to compare buttons","
            This test will check that the add to wishlist and add to compare buttons are visible on the screen
            "
"passed","Tue Jul 04 01:09:46 GMT 2023","Tue Jul 04 01:09:48 GMT 2023","1401","tests","test_main_page","TestMainPage","","","TC 13.01.12 - Check display of block 3 'home-erin' in section 2 in the Promo Block","This test checks if block 3 'home-erin' is displayed in section 2
            of Promo Block under header on the main page"
"passed","Tue Jul 04 01:21:12 GMT 2023","Tue Jul 04 01:21:13 GMT 2023","988","tests","test_training_video_download","TestTrainingVideoDownload","","","TC 18.02.02 Verify message ""We can not find products matching the selection."" is visible","Verify message ""We can not find products matching the selection."" is visible"
"passed","Tue Jul 04 01:01:10 GMT 2023","Tue Jul 04 01:01:12 GMT 2023","1393","tests","test_footer","TestFooter","","","TC 02.01.14 - Check display of Advanced Search link on each page specified in DATA_1","Checks if Advanced Search link is visible on each page in DATA_1"
"passed","Tue Jul 04 01:19:54 GMT 2023","Tue Jul 04 01:19:54 GMT 2023","96","tests","test_sign_in","TestNewCustomers","","","TC 03.01.21 Verify presence of Create an Account button ","Check if 'Create an Account' button is present"
"passed","Tue Jul 04 01:08:32 GMT 2023","Tue Jul 04 01:08:32 GMT 2023","918","tests","test_main_page","TestMainPage","","","test_check_card_rating","This test checks that if a product has a review, then the product card has a rating"
"passed","Tue Jul 04 01:19:40 GMT 2023","Tue Jul 04 01:19:40 GMT 2023","43","tests","test_sign_in","TestRegisteredCustomers","","","TC 03.01.15 Verify Sign in button is clickable","Check if Sign In button is clickable"
"skipped","Tue Jul 04 01:20:21 GMT 2023","Tue Jul 04 01:20:21 GMT 2023","0","tests","test_sign_in","TestFailedLogin","","","TC 03.02.01 to 03_02_10 Verify and Failed Login, no error validation","Check Success and Failed Login, no error validation"
"passed","Tue Jul 04 01:13:49 GMT 2023","Tue Jul 04 01:13:50 GMT 2023","1352","tests","test_promotion_pants","TestPromotionPantsPage","","","test_tc_19_01_01","Checking title of the Shopping Options section"
"passed","Tue Jul 04 01:16:44 GMT 2023","Tue Jul 04 01:16:44 GMT 2023","56","tests","test_sale","TestSalePage","","","TC 10.04.10 - Verify that the sale-20-off contains an image","Check img existence of 1st column in 3-columns Promo Block section"
"passed","Tue Jul 04 01:02:02 GMT 2023","Tue Jul 04 01:02:03 GMT 2023","1307","tests","test_footer","TestFooter","","","TC 02.01.27 - Check text of Contact Us link on each page specified in DATA_1","Checks if text of Contact Us link is correct on each page in DATA_1"
"passed","Tue Jul 04 01:17:12 GMT 2023","Tue Jul 04 01:17:13 GMT 2023","1790","tests","test_shopping_cart","TestShoppingCartFull","","","tc 07.02.01 Verify that title Shopping Cart is displayed correctly when it is full","Check Shopping Cart title is displayed correctly"
"passed","Tue Jul 04 01:18:09 GMT 2023","Tue Jul 04 01:18:13 GMT 2023","4045","tests","test_shopping_cart","TestShoppingCartFull","","","tc 07.02.22 Verify subtotal in Summury Card: subtotal = price * qty and displayed correctly.","Verify subtotal in summary: subtotal = price * qty and displayed correctly."
"passed","Tue Jul 04 01:21:19 GMT 2023","Tue Jul 04 01:21:20 GMT 2023","1303","tests","test_women","TestWomenPage","","","TC 12.05.01/02/03/04 Check the Sidebar text is visible","Check if items are visible"
"passed","Tue Jul 04 01:19:30 GMT 2023","Tue Jul 04 01:19:31 GMT 2023","837","tests","test_sign_in","TestRegisteredCustomers","","","TC 03.01.12 Verify Password field highlighting on click","
        Check the Password field is activated with a cursor and gets highlighted when clicked
        "
"skipped","Tue Jul 04 01:20:21 GMT 2023","Tue Jul 04 01:20:21 GMT 2023","0","tests","test_sign_in","TestFailedLogin","","","TC 03.02.02 to 03_02_10 Verify Error on Failed Login with invalid credentials","Check error on Failed Login with invalid credentials, case-sensitive password and password with spaces"
"passed","Tue Jul 04 01:20:26 GMT 2023","Tue Jul 04 01:20:26 GMT 2023","92","tests","test_training","TestMainPage","","","TC 16.01.02 Verify Sidebar panel title Category is visible and contains text 'Category'","Check Sidebar Category title has correct text and is visible"
"passed","Tue Jul 04 01:04:53 GMT 2023","Tue Jul 04 01:04:54 GMT 2023","1670","tests","test_header","TestHeader","","","TC 01.01.04 display and interactivity of the ""Sign In"" link","Check 'Sign In' link is displayed and underlined"
"passed","Tue Jul 04 01:05:30 GMT 2023","Tue Jul 04 01:05:32 GMT 2023","1738","tests","test_header","TestHeader","","","TC 01.03.01 visible and interactive the link ""What is New""","Verify the link 'What's new' is visible and interactive"
"passed","Tue Jul 04 01:02:33 GMT 2023","Tue Jul 04 01:02:34 GMT 2023","969","tests","test_footer","TestFooter","","","TC 02.01.35 - Check Copyright text is present in the DOM tree on each page specified in DATA_1","Checks if Copyright text is present in the DOM tree on each page specified in DATA_1"
"passed","Tue Jul 04 01:12:02 GMT 2023","Tue Jul 04 01:12:05 GMT 2023","2504","tests","test_men","TestMenPage","","","TC 14.02.05 Verify the link 'Bottoms' redirects to a correct page.","Verify that the link 'Bottoms' correctly opens and redirects to a new webpage, the header 'Bottoms' is
          displayed"
"passed","Tue Jul 04 01:07:27 GMT 2023","Tue Jul 04 01:07:33 GMT 2023","5533","tests","test_header","TestHeader","","","TC 01.01.12 functionality of the ""Sign In"" section in the dropdown list","Check the list appears with sections 'My Account', 'My Wish List', 'Sign Out' after clicking the button,        then clicking on 'Sign Out' redirects to the account page with the header 'You are signed out' displayed         and redirected to the Main Page after 5 seconds"
"passed","Tue Jul 04 01:20:34 GMT 2023","Tue Jul 04 01:20:34 GMT 2023","79","tests","test_training","TestMainPage","","","TC 16.01.05 Verify Sidebar panel title Compare Products is visible and contains text 'Compare Products'","Check Sidebar Category title has correct text and is visible"
"passed","Tue Jul 04 00:59:19 GMT 2023","Tue Jul 04 00:59:21 GMT 2023","2106","tests","test_create_an_account","TestCreateAnAccount","","","test 04.02.04 create an account with empty e-mail"," Verify that customer can't Create An Account with empty e-mail"
"passed","Tue Jul 04 01:06:15 GMT 2023","Tue Jul 04 01:06:17 GMT 2023","2731","tests","test_header","TestHeader","","","TC 01.03.30 correctly redirected the link ""Gear - Fitness Equipment""","Verify the link 'Fitness Equipment' redirected to the page and the 'Fitness Equipment' header is displayed"
"passed","Tue Jul 04 01:16:13 GMT 2023","Tue Jul 04 01:16:14 GMT 2023","1192","tests","test_sale","TestSalePage","","","TC 10.03.03, 10.03.05 - Verify 2 links in Gear Deals open the correct pages","Check that two links in Gear Deals section lead to the correct pages after click"
"passed","Tue Jul 04 01:08:19 GMT 2023","Tue Jul 04 01:08:21 GMT 2023","1429","tests","test_main_page","TestMainPage","","","TC 06.01.02 - verify the card is interactive on hover","This test checks that the card is interactive"
"passed","Tue Jul 04 01:17:34 GMT 2023","Tue Jul 04 01:17:35 GMT 2023","1080","tests","test_shopping_cart","TestShoppingCartFull","","","tc 07.02.05 Verify the subtotal amounts in the item cart and in the Summary cart are the same.","Verify the subtotal amounts in the item cart and in the summary cart are the same."
"passed","Tue Jul 04 01:21:01 GMT 2023","Tue Jul 04 01:21:02 GMT 2023","991","tests","test_training_video_download","TestTrainingVideoDownload","","","TC 18.01.01 subtitle is displayed text compare products","Verify the 'Compare Products' subtitle is visible"
"passed","Tue Jul 04 00:58:27 GMT 2023","Tue Jul 04 00:58:28 GMT 2023","905","tests","test_create_an_account","TestCreateAnAccount","","","TC 04_01_05 Verify First name input field highlighting on click"," Verify that First name input field highlighted when clicked"
"passed","Tue Jul 04 01:01:03 GMT 2023","Tue Jul 04 01:01:04 GMT 2023","1109","tests","test_footer","TestFooter","","","TC 02.01.12 - Check text of Privacy and Cookie Policy link on each page specified in DATA_1","Checks if text of Privacy and Cookie Policy link is correct on each page in DATA_1"
