"Status","Start Time","Stop Time","Duration in ms","Parent Suite","Suite","Sub Suite","Test Class","Test Method","Name","Description"
"passed","Fri Aug 11 00:40:43 GMT 2023","Fri Aug 11 00:40:44 GMT 2023","1251","tests","test_footer","TestFooter","","","TC 02.01.33 - Check Copyright section is present in the DOM tree on each page specified in DATA_1","Checks if Copyright section is present in the DOM tree on each page specified in DATA_1"
"passed","Fri Aug 11 00:45:09 GMT 2023","Fri Aug 11 00:45:11 GMT 2023","1457","tests","test_header","TestHeader","","","TC 01.01.01 greeting message is visible","Check greeting message == 'Default welcome msg!' and is visible"
"passed","Fri Aug 11 00:45:25 GMT 2023","Fri Aug 11 00:45:27 GMT 2023","1590","tests","test_header","TestHeader","","","TC 01.02.04 display and interactivity of the logo","Check that the cursor changes to a 'hand' indicating the logo is a clickable element,         and that clicking on it causes the page to reload and redirect to the main page"
"passed","Fri Aug 11 00:37:06 GMT 2023","Fri Aug 11 00:37:07 GMT 2023","939","tests","test_create_an_account","TestCreateAnAccount","","","TC 04_01_04 Verify First name input field highlighting on label click"," Verify that First name input field highlighted when label is clicked"
"passed","Fri Aug 11 00:51:33 GMT 2023","Fri Aug 11 00:51:34 GMT 2023","922","tests","test_main_page","TestMainPage","","","TC 13.01.39 - Check the display of the text in block 5 'home-eco' in the Promo Block","This test checks if the info block text in section 2 block 5 'home-eco' is correct
            in the Promo Block under header on the main page"
"skipped","Fri Aug 11 00:41:06 GMT 2023","Fri Aug 11 00:41:06 GMT 2023","0","tests","test_footer","TestFooter","","","TC 02.01.48 - Check display of Subscribe Email Field on each page specified in DATA_1","Checks if Subscribe Email Field is visible on each page in DATA_1"
"passed","Fri Aug 11 00:46:07 GMT 2023","Fri Aug 11 00:46:09 GMT 2023","2227","tests","test_header","TestHeader","","","TC 01.03.02 correctly redirected the_link ""What is New""","Verify the link 'What's new' redirected to the page and the 'What's new' header is displayed"
"passed","Fri Aug 11 00:40:48 GMT 2023","Fri Aug 11 00:40:49 GMT 2023","1327","tests","test_footer","TestFooter","","","TC 02.01.34 - Check display of Copyright section on each page specified in DATA_1","Checks if Copyright section is visible on each page in DATA_1"
"passed","Fri Aug 11 00:40:31 GMT 2023","Fri Aug 11 00:40:32 GMT 2023","1353","tests","test_footer","TestFooter","","","TC 02.01.29 - Check display of Write for us link on each page specified in DATA_1","Checks if Write for us link is visible on each page in DATA_1"
"skipped","Fri Aug 11 01:02:23 GMT 2023","Fri Aug 11 01:02:23 GMT 2023","0","tests","test_sign_in","TestFailedLogin","","","TC 03.02.02 to 03_02_10 Verify Error on Failed Login with invalid credentials","Check error on Failed Login with invalid credentials, case-sensitive password and password with spaces"
"passed","Fri Aug 11 00:47:29 GMT 2023","Fri Aug 11 00:47:32 GMT 2023","3763","tests","test_header","TestHeader","","","TC 01.03.20 correctness of the ""Hoodies & Sweatshirts"" link of the ""Men"" section","Check 'Hoodies & Sweatshirts' subsection link click in 'Men' section redirects to the         Hoodies & Sweatshirts-men page and the 'Hoodies & Sweatshirts' header is displayed"
"passed","Fri Aug 11 00:48:13 GMT 2023","Fri Aug 11 00:48:17 GMT 2023","3774","tests","test_header","TestHeader","","","TC 01.03.07 correctness of the ""Jackets"" link of the ""Women"" section","Check 'Jackets' subsection link click in 'Women' section redirects to the Jackets-women page and         the 'Jackets' header is displayed"
"passed","Fri Aug 11 00:50:41 GMT 2023","Fri Aug 11 00:50:42 GMT 2023","1327","tests","test_main_page","TestMainPage","","","TC 13.01.16 - Check the display of the image in block 1 'home-pants' in the Promo Block","This test checks if the image in section 2 block 1 'home-pants' is correct
            in the Promo Block under header on the main page"
"passed","Fri Aug 11 00:40:55 GMT 2023","Fri Aug 11 00:40:56 GMT 2023","939","tests","test_footer","TestFooter","","","TC 02.01.35 - Check Copyright text is present in the DOM tree on each page specified in DATA_1","Checks if Copyright text is present in the DOM tree on each page specified in DATA_1"
"passed","Fri Aug 11 00:50:46 GMT 2023","Fri Aug 11 00:50:47 GMT 2023","1081","tests","test_main_page","TestMainPage","","","TC 13.01.18 - Check the display of the title in block 1 'home-pants' in the Promo Block","This test checks if the info block title in section 2 block 1 'home-pants' is correct
            in the Promo Block under header on the main page"
"passed","Fri Aug 11 01:01:18 GMT 2023","Fri Aug 11 01:01:19 GMT 2023","784","tests","test_sign_in","TestRegisteredCustomers","","","TC 03.01.07 Verify Email field highlighting on click","
        Check the Email field is activated with a cursor and gets highlighted when clicked
        "
"skipped","Fri Aug 11 00:41:06 GMT 2023","Fri Aug 11 00:41:06 GMT 2023","0","tests","test_footer","TestFooter","","","TC 02.01.44 - Check text on Subscribe Button is present in the DOM tree on each page specified in DATA_1","Checks if text on Subscribe Button is present in the DOM tree on each page specified in DATA_1"
"passed","Fri Aug 11 00:53:41 GMT 2023","Fri Aug 11 00:53:42 GMT 2023","1310","tests","test_men","TestMenPagePromoBlock","","","TC 14.06.25 Verify that the 'Shop Shorts' text is visible.","Verify that text-3 in 'Luma shorts' block correctly displayed"
"passed","Fri Aug 11 00:52:07 GMT 2023","Fri Aug 11 00:52:10 GMT 2023","2577","tests","test_main_page","TestMainPage","","","TC 13.02.01 - Check the section 1 link in the Promo Block leads to the correct page","Check that link in section 1 is correct"
"passed","Fri Aug 11 01:01:10 GMT 2023","Fri Aug 11 01:01:10 GMT 2023","83","tests","test_sign_in","TestRegisteredCustomers","","","TC 03.01.04 Verify Email field is present","Check if the Email input field is present"
"passed","Fri Aug 11 00:50:48 GMT 2023","Fri Aug 11 00:50:49 GMT 2023","983","tests","test_main_page","TestMainPage","","","TC 13.01.19 - Check the display of the text in block 1 'home-pants' in the Promo Block","This test checks if the info block text in section 2 block 1 'home-pants' is correct
            in the Promo Block under header on the main page"
"broken","Fri Aug 11 00:43:49 GMT 2023","Fri Aug 11 00:43:54 GMT 2023","5158","tests","test_forgot_your_password","TestForgotYourPassword","","","TC 17.01.16 Verify click Reload captcha button generates a new captcha image","
        Check that the 'Reload captcha' button generates a new captcha image
        and ensure the new image source is different from the original image source
        "
"passed","Fri Aug 11 00:52:03 GMT 2023","Fri Aug 11 00:52:04 GMT 2023","965","tests","test_main_page","TestMainPage","","","TC 13.01.53 - Check if block 4 'home-performance' in section 2 is clickablein the Promo Block on the main page","This test checks if block 4 'home-performance' in section 2 in Promo Block under header is clickable"
"passed","Fri Aug 11 00:39:20 GMT 2023","Fri Aug 11 00:39:21 GMT 2023","1312","tests","test_footer","TestFooter","","","TC 02.01.12 - Check text of Privacy and Cookie Policy link on each page specified in DATA_1","Checks if text of Privacy and Cookie Policy link matches expected on each page in DATA_1"
"passed","Fri Aug 11 00:53:09 GMT 2023","Fri Aug 11 00:53:11 GMT 2023","2334","tests","test_men","TestMenPage","","","TC 14.03.09 Verify the link 'Tanks' redirects to a correct page.","Verify that the link 'Tanks' correctly opens and redirects to a new webpage,         the header 'Tanks' is displayed"
"passed","Fri Aug 11 01:01:15 GMT 2023","Fri Aug 11 01:01:16 GMT 2023","414","tests","test_sign_in","TestRegisteredCustomers","","","TC 03.01.06 Verify Email field is appropriately labeled","Check if Email field is appropriately labeled "
"skipped","Fri Aug 11 00:41:06 GMT 2023","Fri Aug 11 00:41:06 GMT 2023","0","tests","test_footer","TestFooter","","","TC 02.01.39 - Check display of Subscribe section on each page specified in DATA_1","Checks if Subscribe section is visible on each page in DATA_1"
"passed","Fri Aug 11 00:45:21 GMT 2023","Fri Aug 11 00:45:24 GMT 2023","2709","tests","test_header","TestHeader","","","TC 01.01.05 correctness of the ""Sign In"" link","Check 'Sign In' link click redirects to the login page and the ""Customer Login"" header is displayed"
"broken","Fri Aug 11 00:42:56 GMT 2023","Fri Aug 11 00:43:01 GMT 2023","5151","tests","test_forgot_your_password","TestForgotYourPassword","","","TC 17.01.09 Verify FYP captcha input field is present","Check if the captcha input field is present"
"skipped","Fri Aug 11 00:41:06 GMT 2023","Fri Aug 11 00:41:06 GMT 2023","0","tests","test_footer","TestFooter","","","TC 02.01.39 - Check display of Subscribe section on each page specified in DATA_1","Checks if Subscribe section is visible on each page in DATA_1"
"passed","Fri Aug 11 01:01:24 GMT 2023","Fri Aug 11 01:01:25 GMT 2023","78","tests","test_sign_in","TestRegisteredCustomers","","","TC 03.01.09 Verify Password field is present","Check if the password input field is present"
"passed","Fri Aug 11 00:54:22 GMT 2023","Fri Aug 11 00:54:23 GMT 2023","994","tests","test_men","TestMenPagePromoBlock","","","TC 14.06.16 Verify the visibility of the image in the 'Last chance for pants' promo block.","Verify that the image in the block 'Last chance for pants' is displayed on the Men page"
"passed","Fri Aug 11 00:51:51 GMT 2023","Fri Aug 11 00:51:52 GMT 2023","892","tests","test_main_page","TestMainPage","","","TC 13.01.48 - Check block 5 'home-eco' in section 2 of the Promo Block is present in the DOM tree","This test checks if block 5 'home-eco' in section 2 in the Promo Block is present
            in the DOM tree on the main page"
"passed","Fri Aug 11 00:36:58 GMT 2023","Fri Aug 11 00:36:58 GMT 2023","90","tests","test_create_an_account","TestCreateAnAccount","","","TC 04_01_01 Verify Create An Account Page h1 Header"," Verify that the Create An Account page heading is present. "
"passed","Fri Aug 11 01:03:25 GMT 2023","Fri Aug 11 01:03:26 GMT 2023","1188","tests","test_women","TestWomenPage","","","TC 12.05.01/02/03/04 Check the Sidebar text is visible","Check if items are visible"
"passed","Fri Aug 11 00:53:44 GMT 2023","Fri Aug 11 00:53:46 GMT 2023","2163","tests","test_men","TestMenPagePromoBlock","","","TC 14.06.26 Verify the click on the block 'Luma shorts' redirects to a correct page.","Verify that the click on the block 'Luma shorts' correctly redirects to a new webpage"
"passed","Fri Aug 11 00:41:18 GMT 2023","Fri Aug 11 00:41:19 GMT 2023","1257","tests","test_footer","TestFooter","","","TC 02.01.54 - Check if 'Subscribe to our mailing list' link is clickable on each page specified in DATA_1","This test checks if 'Subscribe to our mailing list' link is clickable on each page specified in DATA_1"
"passed","Fri Aug 11 00:39:52 GMT 2023","Fri Aug 11 00:39:54 GMT 2023","1365","tests","test_footer","TestFooter","","","TC 02.01.19 - Check display of Orders and Returns link on each page specified in DATA_1","Checks if Orders and Returns link is visible on each page in DATA_1"
"passed","Fri Aug 11 01:00:56 GMT 2023","Fri Aug 11 01:01:00 GMT 2023","4478","tests","test_shopping_cart","TestShoppingCartFull","","","TC 07.02.28 Verify that the price in list of items in the Shopping Cart is displayed correct","Check that the price in list of items in the Shopping Cart
        contains item with correct price which was added from More Choices"
"passed","Fri Aug 11 00:52:51 GMT 2023","Fri Aug 11 00:52:53 GMT 2023","1954","tests","test_men","TestMenPage","","","TC 14.03.04 Verify the link 'Jackets' is visible and clickable.","Verify that the link 'Jackets' is displayed and clickable"
"passed","Fri Aug 11 00:52:29 GMT 2023","Fri Aug 11 00:52:31 GMT 2023","1646","tests","test_men","TestMenPage","","","TC 14.02.02 Verify the link Tops is visible and clickable.",""
"passed","Fri Aug 11 00:57:33 GMT 2023","Fri Aug 11 00:57:33 GMT 2023","222","tests","test_sale","TestSalePage","","","TC 10.04.07 - Verify that the Gear Deals contains an image","Check img existence of Gear Deals section"
"passed","Fri Aug 11 00:55:00 GMT 2023","Fri Aug 11 00:55:02 GMT 2023","1524","tests","test_promotion_pants","TestPromotionPantsPage","","","test_tc_19_01_02","Checking title of the Style section"
"passed","Fri Aug 11 00:50:43 GMT 2023","Fri Aug 11 00:50:44 GMT 2023","1362","tests","test_main_page","TestMainPage","","","TC 13.01.17 - Check the display of the info block in block 1 'home-pants' in the Promo Block","This test checks if info block in section 2 block 1 'home-pants' is displayed
            in the Promo Block under header on the main page"
"passed","Fri Aug 11 00:40:53 GMT 2023","Fri Aug 11 00:40:54 GMT 2023","980","tests","test_footer","TestFooter","","","TC 02.01.35 - Check Copyright text is present in the DOM tree on each page specified in DATA_1","Checks if Copyright text is present in the DOM tree on each page specified in DATA_1"
"passed","Fri Aug 11 00:56:09 GMT 2023","Fri Aug 11 00:56:09 GMT 2023","191","tests","test_sale","TestSalePage","","","TC 10.01.02, 10.01.04, 10.01.06, 10.01.08, 10.01.10, 10.01.12 - Verify 6 links in Women's Deals section are visible and clickable","Check that six elements in Women's Deals section are displayed and enabled"
"passed","Fri Aug 11 00:46:33 GMT 2023","Fri Aug 11 00:46:34 GMT 2023","1905","tests","test_header","TestHeader","","","TC 01.03.15 display and interactivity of the ""Men"" section","Check the 'Tops' & 'Bottoms' subsections in 'Men' section is displayed"
"passed","Fri Aug 11 00:40:19 GMT 2023","Fri Aug 11 00:40:20 GMT 2023","1233","tests","test_footer","TestFooter","","","TC 02.01.27 - Check text of 'Contact us' link on each page specified in DATA_1","Checks if text of 'Contact us' link is correct on each page in DATA_1"
"passed","Fri Aug 11 00:45:00 GMT 2023","Fri Aug 11 00:45:03 GMT 2023","2246","tests","test_gear","TestGearPage","","","test_TC_11_01_05","Check that fitness_equipment link is correct"
"skipped","Fri Aug 11 01:02:23 GMT 2023","Fri Aug 11 01:02:23 GMT 2023","0","tests","test_sign_in","TestFailedLogin","","","TC 03.02.02 to 03_02_10 Verify Error on Failed Login with invalid credentials","Check error on Failed Login with invalid credentials, case-sensitive password and password with spaces"
"passed","Fri Aug 11 00:41:07 GMT 2023","Fri Aug 11 00:41:08 GMT 2023","933","tests","test_footer","TestFooter","","","TC 02.01.52 - Check 'Subscribe to our mailing list' link is present in the DOM tree on each page specified in DATA_1","Checks if 'Subscribe to our mailing list' link is present in the DOM tree on each page
        specified in DATA_1"
"passed","Fri Aug 11 00:42:11 GMT 2023","Fri Aug 11 00:42:15 GMT 2023","3925","tests","test_footer","TestFooter","","","TC 02.02.06 - Check Write for us link in footer leads to the correct page from each page specified in DATA_1","Check that Write for us link in footer is correct"
"passed","Fri Aug 11 00:42:37 GMT 2023","Fri Aug 11 00:42:37 GMT 2023","267","tests","test_forgot_your_password","TestForgotYourPassword","","","TC 17.01.02 Verify Forgot Your Password note","Check Registered Customers note is present "
"passed","Fri Aug 11 00:44:12 GMT 2023","Fri Aug 11 00:44:12 GMT 2023","278","tests","test_forgot_your_password","TestForgotYourPassword","","","TC 17.01.19 Verify Reset My Password button is present","Check if the 'Reload captcha' button is present"
"passed","Fri Aug 11 00:46:48 GMT 2023","Fri Aug 11 00:46:50 GMT 2023","2883","tests","test_header","TestHeader","","","TC 01.03.31 correctly redirected the link ""Gear - Watches""","Verify the link 'Fitness Equipment' redirected to the page and the 'Fitness Equipment' header is displayed"
"passed","Fri Aug 11 00:52:00 GMT 2023","Fri Aug 11 00:52:02 GMT 2023","1130","tests","test_main_page","TestMainPage","","","TC 13.01.52 - Check if block 3 'home-erin' in section 2 is clickablein the Promo Block on the main page","This test checks if block 3 'home-erin' in section 2 in Promo Block under header is clickable"
"passed","Fri Aug 11 00:57:04 GMT 2023","Fri Aug 11 00:57:05 GMT 2023","1259","tests","test_sale","TestSalePage","","","TC 10.02.03, 10.02.05, 10.02.07, 10.02.09, 10.02.11 - Verify 5 links in Men's Deals open the correct pages","Check that five links in Men's Deals section lead to the correct pages after click"
"passed","Fri Aug 11 00:39:13 GMT 2023","Fri Aug 11 00:39:14 GMT 2023","1140","tests","test_footer","TestFooter","","","TC 02.01.09 - Check display of Privacy and Cookie Policy link on each page specified in DATA_1","Checks if Privacy and Cookie Policy link is visible on each page in DATA_1"
"passed","Fri Aug 11 00:45:57 GMT 2023","Fri Aug 11 00:45:59 GMT 2023","1614","tests","test_header","TestHeader","","","TC 01.03.01 visible and interactive the link ""What is New""","Verify the link 'What's new' is visible and interactive"
"passed","Fri Aug 11 01:02:42 GMT 2023","Fri Aug 11 01:02:43 GMT 2023","354","tests","test_training","TestMainPage","","","TC 16.02.02 - Check the display of block 1 main","This test checks block-promo training-main is displayed"
"passed","Fri Aug 11 00:40:09 GMT 2023","Fri Aug 11 00:40:11 GMT 2023","1168","tests","test_footer","TestFooter","","","TC 02.01.24 - Check display of 'Contact us' link on each page specified in DATA_1","Checks if 'Contact us' link is visible on each page in DATA_1"
"passed","Fri Aug 11 00:54:03 GMT 2023","Fri Aug 11 00:54:05 GMT 2023","1343","tests","test_men","TestMenPagePromoBlock","","","TC 14.06.33 Verify the visibility of 'Luma hoodies' promo block.","Verify that the block 'Luma hoodies' is displayed on the Men page"
"passed","Fri Aug 11 00:56:11 GMT 2023","Fri Aug 11 00:56:11 GMT 2023","46","tests","test_sale","TestSalePage","","","TC 10.01.02, 10.01.04, 10.01.06, 10.01.08, 10.01.10, 10.01.12 - Verify 6 links in Women's Deals section are visible and clickable","Check that six elements in Women's Deals section are displayed and enabled"
"passed","Fri Aug 11 00:58:09 GMT 2023","Fri Aug 11 00:58:11 GMT 2023","1287","tests","test_shopping_cart","TestShoppingCart","","","tc 07.01.03 Verify that here link is displayed and clickable","Check that the here link is displayed and clickable."
"passed","Fri Aug 11 01:01:48 GMT 2023","Fri Aug 11 01:01:48 GMT 2023","344","tests","test_sign_in","TestRegisteredCustomers","","","TC 03.01.18 Verify Email field for correct email format","Check error message for incorrect email format in email field"
"passed","Fri Aug 11 00:41:21 GMT 2023","Fri Aug 11 00:41:22 GMT 2023","1016","tests","test_footer","TestFooter","","","TC 02.01.56 - Check text of 'Subscribe to our mailing list' link on each page specified in DATA_1","Checks if text of 'Subscribe to our mailing list' link is correct on each page in DATA_1"
"passed","Fri Aug 11 00:48:34 GMT 2023","Fri Aug 11 00:48:36 GMT 2023","2184","tests","test_header","TestHeader","","","TC 01.03.11 display and interactivity of the ""Bottoms"" section of the ""Women"" section","Check the 'Bottoms' subsection in 'Women' section is displayed and the 'Pants' and 'Shorts'         subsections is displayed"
"passed","Fri Aug 11 00:40:07 GMT 2023","Fri Aug 11 00:40:08 GMT 2023","1273","tests","test_footer","TestFooter","","","TC 02.01.23 - Check 'Contact us' link is present in the DOM tree on each page specified in DATA_1","Checks if 'Contact us' link is present in the DOM tree on each page specified in DATA_1"
"passed","Fri Aug 11 00:48:08 GMT 2023","Fri Aug 11 00:48:11 GMT 2023","3127","tests","test_header","TestHeader","","","TC 01.03.06 correctness of the ""Tops"" link of the ""Women"" section","Check 'Tops' subsection link click in 'Women' section redirects to the Tops-women page and         the 'Tops' header is displayed"
"passed","Fri Aug 11 00:44:15 GMT 2023","Fri Aug 11 00:44:15 GMT 2023","158","tests","test_forgot_your_password","TestForgotYourPassword","","","TC 17.01.20 Verify Reset My Password button is clickable","Check that the 'Reset My Password' button is clickable"
"passed","Fri Aug 11 00:46:01 GMT 2023","Fri Aug 11 00:46:02 GMT 2023","905","tests","test_header","TestHeader","","","TC 01.03.03 display and interactivity of the ""Women"" section","Verify that the section Women in the header is visible and interactive"
"passed","Fri Aug 11 00:52:14 GMT 2023","Fri Aug 11 00:52:17 GMT 2023","2412","tests","test_main_page","TestMainPage","","","TC 13.02.03 - Check the link in section 2 block 2 'home-t-shirts' in the Promo Block leads to the correct page","Check that link in section 2 block 2 'home-t-shirts' is correct"
"passed","Fri Aug 11 00:50:17 GMT 2023","Fri Aug 11 00:50:18 GMT 2023","1335","tests","test_main_page","TestMainPage","","","TC 13.01.02 - Check the display of section 1 in the Promo Block","This test checks if section 1 in Promo Block under header is displayed on the main page"
"passed","Fri Aug 11 00:40:14 GMT 2023","Fri Aug 11 00:40:15 GMT 2023","1317","tests","test_footer","TestFooter","","","TC 02.01.25 - Check if 'Contact us' link is clickable on each page specified in DATA_1","This test checks if 'Contact us' link is clickable on each page specified in DATA_1"
"passed","Fri Aug 11 00:39:57 GMT 2023","Fri Aug 11 00:39:59 GMT 2023","1339","tests","test_footer","TestFooter","","","TC 02.01.20 - Check if Orders and Returns link is clickable on each page specified in DATA_1","This test checks if Orders and Returns link is clickable on each page specified in DATA_1"
"skipped","Fri Aug 11 00:41:06 GMT 2023","Fri Aug 11 00:41:06 GMT 2023","0","tests","test_footer","TestFooter","","","TC 02.01.38 - Check Subscribe section is present in the DOM tree on each page specified in DATA_1","Checks if Subscribe section is present in the DOM tree on each page specified in DATA_1"
"passed","Fri Aug 11 00:56:23 GMT 2023","Fri Aug 11 00:56:25 GMT 2023","1326","tests","test_sale","TestSalePage","","","TC 10.01.03, 10.01.05, 10.01.07, 10.01.09, 10.01.11, 10.01.13 - Verify 6 links in Women's Deals open the correct pages","Check that six links in Women's Deals section lead to the correct pages after click"
"passed","Fri Aug 11 01:03:12 GMT 2023","Fri Aug 11 01:03:14 GMT 2023","1303","tests","test_training_video_download","TestTrainingVideoDownload","","","TC 18.02.01 title ""Video Download"" is visible","Verify title 'Video Download' is visible"
"skipped","Fri Aug 11 00:56:43 GMT 2023","Fri Aug 11 00:56:44 GMT 2023","411","tests","test_sale","TestSalePage","","","TC 10.02.01 - Verify 'MEN'S DEALS' title is correct","Check title of Men's Deals section"
"passed","Fri Aug 11 00:56:21 GMT 2023","Fri Aug 11 00:56:21 GMT 2023","145","tests","test_sale","TestSalePage","","","TC 10.01.02, 10.01.04, 10.01.06, 10.01.08, 10.01.10, 10.01.12 - Verify 6 links in Women's Deals section are visible and clickable","Check that six elements in Women's Deals section are displayed and enabled"
"passed","Fri Aug 11 01:02:56 GMT 2023","Fri Aug 11 01:02:56 GMT 2023","364","tests","test_training","TestMainPage","","","TC 16.02.07 Check the cursor change to block training erin","This test check the cursor change when hovering over the block training erin"
"passed","Fri Aug 11 00:47:09 GMT 2023","Fri Aug 11 00:47:13 GMT 2023","4140","tests","test_header","TestHeader","","","TC 01.01.08 display of the dropdown list button ","Check the dropdown button is displayed if the user is authorized"
"passed","Fri Aug 11 00:51:10 GMT 2023","Fri Aug 11 00:51:11 GMT 2023","895","tests","test_main_page","TestMainPage","","","TC 13.01.29 - Check the display of the text in block 3 'home-erin' in the Promo Block","This test checks if the info block text in section 2 block 3 'home-erin' is correct
            in the Promo Block under header on the main page"
"passed","Fri Aug 11 01:03:20 GMT 2023","Fri Aug 11 01:03:21 GMT 2023","1402","tests","test_women","TestWomenPage","","","TC 12.02.01 Check side panel title Category is visible","Check Category title is visible"
"passed","Fri Aug 11 00:45:28 GMT 2023","Fri Aug 11 00:45:30 GMT 2023","2545","tests","test_header","TestHeader","","","TC 01.03.36 correctly redirected the link sale","Verify 'Sale' link click redirected to the page and the 'Sale' header is displayed"
"passed","Fri Aug 11 01:02:53 GMT 2023","Fri Aug 11 01:02:53 GMT 2023","365","tests","test_training","TestMainPage","","","TC 16.02.06 Check the cursor change to block training main ","This test check the cursor change when hovering over the block training main"
"passed","Fri Aug 11 00:53:18 GMT 2023","Fri Aug 11 00:53:20 GMT 2023","2334","tests","test_men","TestMenPage","","","TC 14.04.03 Verify the link 'Pants' redirects to a correct page.","Verify that the link 'Pants' correctly opens and redirects to a new webpage, the header 'Pants' is
              displayed"
"passed","Fri Aug 11 00:47:51 GMT 2023","Fri Aug 11 00:47:56 GMT 2023","5750","tests","test_header","TestHeader","","","TC 01.01.11 functionality of the ""My Wish List"" section in the dropdown list","Check the list appears with sections 'My Account', 'My Wish List', 'Sign Out' after clicking the button,        then clicking on 'My Wish List' redirects to the account page with the header 'My Wish List' displayed"
"passed","Fri Aug 11 00:58:02 GMT 2023","Fri Aug 11 00:58:03 GMT 2023","418","tests","test_sale","TestSalePage","","","TC 10.04.13 - Verify the text in 3-columns block - sale-free-shipping","Check title-text and content-text in 3-columns block - sale-free-shipping"
